{
  "order_id": "O-20260916-0001",
  "order_no": "PO-20260916-0001",
  "owner_user_id": "demo-a",
  "supplier_id": "S001",
  "currency": "CNY",
  "total_amount": "1275.00",
  "version": 1,
  "created_at": "2026-09-16T00:00:00Z",
  "updated_at": "2026-09-16T00:00:00Z",
  "note": "演示采购",
  "lines": [
    {
      "line_no": 1,
      "part_id": "P001",
      "quantity": 50,
      "unit_price": "25.50",
      "line_amount": "1275.00"
    }
  ]
}
